[
  {
    "is_synthetic": true,
    "id": "USR-001",
    "display_name": "演示专员001",
    "team_id": "TEAM-DE-TECHNICAL",
    "role": "specialist",
    "languages": [
      "de",
      "en"
    ],
    "skills": [
      "technical"
    ],
    "availability": "online",
    "capacity": 12,
    "current_open_ticket_count": 8,
    "email": "agent-001@example.invalid"
  },
  {
    "is_synthetic": true,
    "id": "USR-002",
    "display_name": "演示专员002",
    "team_id": "TEAM-DE-TECHNICAL",
    "role": "specialist",
    "languages": [
      "de",
      "en"
    ],
    "skills": [
      "technical"
    ],
    "availability": "busy",
    "capacity": 12,
    "current_open_ticket_count": 0,
    "email": "agent-002@example.invalid"
  },
  {
    "is_synthetic": true,
    "id": "USR-003",
    "display_name": "演示专员003",
    "team_id": "TEAM-DE-CLOUD",
    "role": "specialist",
    "languages": [
      "de",
      "en"
    ],
    "skills": [
      "cloud"
    ],
    "availability": "online",
    "capacity": 12,
    "current_open_ticket_count": 3,
    "email": "agent-003@example.invalid"
  },
  {
    "is_synthetic": true,
    "id": "USR-004",
    "display_name": "演示专员004",
    "team_id": "TEAM-DE-CLOUD",
    "role": "specialist",
    "languages": [
      "de",
      "en"
    ],
    "skills": [
      "cloud"
    ],
    "availability": "offline",
    "capacity": 12,
    "current_open_ticket_count": 0,
    "email": "agent-004@example.invalid"
  },
  {
    "is_synthetic": true,
    "id": "USR-005",
    "display_name": "演示专员005",
    "team_id": "TEAM-DE-WARRANTY",
    "role": "specialist",
    "languages": [
      "de",
      "en"
    ],
    "skills": [
      "warranty"
    ],
    "availability": "online",
    "capacity": 12,
    "current_open_ticket_count": 0,
    "email": "agent-005@example.invalid"
  },
  {
    "is_synthetic": true,
    "id": "USR-006",
    "display_name": "演示专员006",
    "team_id": "TEAM-DE-WARRANTY",
    "role": "specialist",
    "languages": [
      "de",
      "en"
    ],
    "skills": [
      "warranty"
    ],
    "availability": "leave",
    "capacity": 12,
    "current_open_ticket_count": 0,
    "email": "agent-006@example.invalid"
  },
  {
    "is_synthetic": true,
    "id": "USR-007",
    "display_name": "演示专员007",
    "team_id": "TEAM-NL-TECHNICAL",
    "role": "specialist",
    "languages": [
      "nl",
      "en"
    ],
    "skills": [
      "technical"
    ],
    "availability": "online",
    "capacity": 12,
    "current_open_ticket_count": 9,
    "email": "agent-007@example.invalid"
  },
  {
    "is_synthetic": true,
    "id": "USR-008",
    "display_name": "演示专员008",
    "team_id": "TEAM-NL-TECHNICAL",
    "role": "specialist",
    "languages": [
      "nl",
      "en"
    ],
    "skills": [
      "technical"
    ],
    "availability": "busy",
    "capacity": 12,
    "current_open_ticket_count": 0,
    "email": "agent-008@example.invalid"
  },
  {
    "is_synthetic": true,
    "id": "USR-009",
    "display_name": "演示专员009",
    "team_id": "TEAM-NL-CLOUD",
    "role": "specialist",
    "languages": [
      "nl",
      "en"
    ],
    "skills": [
      "cloud"
    ],
    "availability": "online",
    "capacity": 12,
    "current_open_ticket_count": 0,
    "email": "agent-009@example.invalid"
  },
  {
    "is_synthetic": true,
    "id": "USR-010",
    "display_name": "演示专员010",
    "team_id": "TEAM-NL-CLOUD",
    "role": "specialist",
    "languages": [
      "nl",
      "en"
    ],
    "skills": [
      "cloud"
    ],
    "availability": "offline",
    "capacity": 12,
    "current_open_ticket_count": 0,
    "email": "agent-010@example.invalid"
  },
  {
    "is_synthetic": true,
    "id": "USR-011",
    "display_name": "演示专员011",
    "team_id": "TEAM-NL-WARRANTY",
    "role": "specialist",
    "languages": [
      "nl",
      "en"
    ],
    "skills": [
      "warranty"
    ],
    "availability": "online",
    "capacity": 12,
    "current_open_ticket_count": 0,
    "email": "agent-011@example.invalid"
  },
  {
    "is_synthetic": true,
    "id": "USR-012",
    "display_name": "演示专员012",
    "team_id": "TEAM-NL-WARRANTY",
    "role": "specialist",
    "languages": [
      "nl",
      "en"
    ],
    "skills": [
      "warranty"
    ],
    "availability": "leave",
    "capacity": 12,
    "current_open_ticket_count": 0,
    "email": "agent-012@example.invalid"
  },
  {
    "is_synthetic": true,
    "id": "USR-013",
    "display_name": "演示专员013",
    "team_id": "TEAM-ES-TECHNICAL",
    "role": "specialist",
    "languages": [
      "es",
      "en"
    ],
    "skills": [
      "technical"
    ],
    "availability": "online",
    "capacity": 12,
    "current_open_ticket_count": 8,
    "email": "agent-013@example.invalid"
  },
  {
    "is_synthetic": true,
    "id": "USR-014",
    "display_name": "演示专员014",
    "team_id": "TEAM-ES-TECHNICAL",
    "role": "specialist",
    "languages": [
      "es",
      "en"
    ],
    "skills": [
      "technical"
    ],
    "availability": "busy",
    "capacity": 12,
    "current_open_ticket_count": 0,
    "email": "agent-014@example.invalid"
  },
  {
    "is_synthetic": true,
    "id": "USR-015",
    "display_name": "演示专员015",
    "team_id": "TEAM-ES-CLOUD",
    "role": "specialist",
    "languages": [
      "es",
      "en"
    ],
    "skills": [
      "cloud"
    ],
    "availability": "online",
    "capacity": 12,
    "current_open_ticket_count": 5,
    "email": "agent-015@example.invalid"
  },
  {
    "is_synthetic": true,
    "id": "USR-016",
    "display_name": "演示专员016",
    "team_id": "TEAM-ES-CLOUD",
    "role": "specialist",
    "languages": [
      "es",
      "en"
    ],
    "skills": [
      "cloud"
    ],
    "availability": "offline",
    "capacity": 12,
    "current_open_ticket_count": 0,
    "email": "agent-016@example.invalid"
  },
  {
    "is_synthetic": true,
    "id": "USR-017",
    "display_name": "演示专员017",
    "team_id": "TEAM-ES-WARRANTY",
    "role": "specialist",
    "languages": [
      "es",
      "en"
    ],
    "skills": [
      "warranty"
    ],
    "availability": "online",
    "capacity": 12,
    "current_open_ticket_count": 0,
    "email": "agent-017@example.invalid"
  },
  {
    "is_synthetic": true,
    "id": "USR-018",
    "display_name": "演示专员018",
    "team_id": "TEAM-ES-WARRANTY",
    "role": "specialist",
    "languages": [
      "es",
      "en"
    ],
    "skills": [
      "warranty"
    ],
    "availability": "leave",
    "capacity": 12,
    "current_open_ticket_count": 0,
    "email": "agent-018@example.invalid"
  },
  {
    "is_synthetic": true,
    "id": "USR-019",
    "display_name": "演示专员019",
    "team_id": "TEAM-GB-TECHNICAL",
    "role": "specialist",
    "languages": [
      "en"
    ],
    "skills": [
      "technical"
    ],
    "availability": "online",
    "capacity": 17,
    "current_open_ticket_count": 15,
    "email": "agent-019@example.invalid"
  },
  {
    "is_synthetic": true,
    "id": "USR-020",
    "display_name": "演示专员020",
    "team_id": "TEAM-GB-TECHNICAL",
    "role": "specialist",
    "languages": [
      "en"
    ],
    "skills": [
      "technical"
    ],
    "availability": "busy",
    "capacity": 12,
    "current_open_ticket_count": 0,
    "email": "agent-020@example.invalid"
  },
  {
    "is_synthetic": true,
    "id": "USR-021",
    "display_name": "演示专员021",
    "team_id": "TEAM-GB-CLOUD",
    "role": "specialist",
    "languages": [
      "en"
    ],
    "skills": [
      "cloud"
    ],
    "availability": "online",
    "capacity": 12,
    "current_open_ticket_count": 9,
    "email": "agent-021@example.invalid"
  },
  {
    "is_synthetic": true,
    "id": "USR-022",
    "display_name": "演示专员022",
    "team_id": "TEAM-GB-CLOUD",
    "role": "specialist",
    "languages": [
      "en"
    ],
    "skills": [
      "cloud"
    ],
    "availability": "offline",
    "capacity": 12,
    "current_open_ticket_count": 0,
    "email": "agent-022@example.invalid"
  },
  {
    "is_synthetic": true,
    "id": "USR-023",
    "display_name": "演示专员023",
    "team_id": "TEAM-GB-WARRANTY",
    "role": "specialist",
    "languages": [
      "en"
    ],
    "skills": [
      "warranty"
    ],
    "availability": "online",
    "capacity": 12,
    "current_open_ticket_count": 0,
    "email": "agent-023@example.invalid"
  },
  {
    "is_synthetic": true,
    "id": "USR-024",
    "display_name": "演示专员024",
    "team_id": "TEAM-GB-WARRANTY",
    "role": "specialist",
    "languages": [
      "en"
    ],
    "skills": [
      "warranty"
    ],
    "availability": "leave",
    "capacity": 12,
    "current_open_ticket_count": 0,
    "email": "agent-024@example.invalid"
  },
  {
    "is_synthetic": true,
    "id": "USR-025",
    "display_name": "演示专员025",
    "team_id": "TEAM-AU-TECHNICAL",
    "role": "specialist",
    "languages": [
      "en"
    ],
    "skills": [
      "technical"
    ],
    "availability": "online",
    "capacity": 15,
    "current_open_ticket_count": 13,
    "email": "agent-025@example.invalid"
  },
  {
    "is_synthetic": true,
    "id": "USR-026",
    "display_name": "演示专员026",
    "team_id": "TEAM-AU-TECHNICAL",
    "role": "specialist",
    "languages": [
      "en"
    ],
    "skills": [
      "technical"
    ],
    "availability": "busy",
    "capacity": 12,
    "current_open_ticket_count": 0,
    "email": "agent-026@example.invalid"
  },
  {
    "is_synthetic": true,
    "id": "USR-027",
    "display_name": "演示专员027",
    "team_id": "TEAM-AU-CLOUD",
    "role": "specialist",
    "languages": [
      "en"
    ],
    "skills": [
      "cloud"
    ],
    "availability": "online",
    "capacity": 12,
    "current_open_ticket_count": 3,
    "email": "agent-027@example.invalid"
  },
  {
    "is_synthetic": true,
    "id": "USR-028",
    "display_name": "演示专员028",
    "team_id": "TEAM-AU-CLOUD",
    "role": "specialist",
    "languages": [
      "en"
    ],
    "skills": [
      "cloud"
    ],
    "availability": "offline",
    "capacity": 12,
    "current_open_ticket_count": 0,